{
  "schemaVersion": 1,
  "profiles": [
    {
      "id": "m3-classic.compose-material3-1.4.0",
      "path": "classic/compose-material3-1.4.0/profile.json",
      "profile": "classic",
      "stability": "stable"
    },
    {
      "id": "m3-expressive.compose-material3-1.5.0-alpha27",
      "path": "expressive/compose-material3-1.5.0-alpha27/profile.json",
      "profile": "expressive",
      "stability": "experimental"
    }
  ],
  "components": [
    {
      "id": "classic.buttons",
      "path": "classic/compose-material3-1.4.0/components/buttons.json",
      "profileId": "m3-classic.compose-material3-1.4.0",
      "status": "seeded"
    }
  ],
  "suites": [
    {
      "id": "classic.buttons.seed",
      "path": "classic/compose-material3-1.4.0/suites/buttons-seed.json",
      "profileId": "m3-classic.compose-material3-1.4.0",
      "componentModelId": "classic.buttons",
      "status": "seeded"
    },
    {
      "id": "classic.buttons.filled.structure",
      "path": "classic/compose-material3-1.4.0/suites/filled-button-structure.json",
      "profileId": "m3-classic.compose-material3-1.4.0",
      "componentModelId": "classic.buttons",
      "status": "evidence-backed"
    },
    {
      "id": "classic.buttons.filled.renderer",
      "path": "classic/compose-material3-1.4.0/suites/filled-button-renderer.json",
      "profileId": "m3-classic.compose-material3-1.4.0",
      "componentModelId": "classic.buttons",
      "status": "evidence-backed"
    },
    {
      "id": "classic.buttons.elevated.renderer",
      "path": "classic/compose-material3-1.4.0/suites/elevated-button-renderer.json",
      "profileId": "m3-classic.compose-material3-1.4.0",
      "componentModelId": "classic.buttons",
      "status": "evidence-backed"
    },
    {
      "id": "classic.buttons.filled-tonal.renderer",
      "path": "classic/compose-material3-1.4.0/suites/filled-tonal-button-renderer.json",
      "profileId": "m3-classic.compose-material3-1.4.0",
      "componentModelId": "classic.buttons",
      "status": "evidence-backed"
    },
    {
      "id": "classic.buttons.outlined.renderer",
      "path": "classic/compose-material3-1.4.0/suites/outlined-button-renderer.json",
      "profileId": "m3-classic.compose-material3-1.4.0",
      "componentModelId": "classic.buttons",
      "status": "evidence-backed"
    },
    {
      "id": "classic.buttons.text.renderer",
      "path": "classic/compose-material3-1.4.0/suites/text-button-renderer.json",
      "profileId": "m3-classic.compose-material3-1.4.0",
      "componentModelId": "classic.buttons",
      "status": "evidence-backed"
    }
  ],
  "visualContracts": [
    {
      "id": "classic.buttons.visual",
      "path": "classic/compose-material3-1.4.0/visual/buttons.json",
      "profileId": "m3-classic.compose-material3-1.4.0",
      "componentModelId": "classic.buttons",
      "status": "contract-only"
    }
  ]
}
